{
    "interface": {
        "ethernet": {
            "eth-1": {
                "speed": "100G"
            }
        },
        "aggregate-ethernet": {}
    },
    "vlan": {
        "id": {
            "2": {
                "members": {
                    "eth-1": null
                }
            }
        }
    },
    "protocol": {
        
    },
    "platform": {
        "port": {
            "eth-1": {
                "breakout-mode": "none"
            }
        }
    }
}
