{
    "interface": {
        "aggregate-ethernet": {},
        "ethernet": {
            "eth-1": {
                "speed": "100G"
            },
            "eth-2": {
                "speed": "100G"
            }
        }
    },
    "platform": {
        "port": {
            "eth-1": {
                "breakout-mode": "none"
            },
            "eth-2": {
                "breakout-mode": "none"
            }
        }
    },
    "protocol": {},
    "vlan": {
        "id": {
            "2": {
                "members": {
                    "eth-1": null,
                    "eth-2": null
                }
            }
        }
    }
}